{
  "id": "alpha",
  "name": "Alpha User Provider",
  "description": "User package for discovery tests",
  "version": "1.0.0",
  "author": "KLookup Tests",
  "license": "GPL-3.0-or-later",
  "runtime": "javascript",
  "entry": "main.mjs",
  "permissions": {
    "origins": ["api.alpha.example.com"],
    "secrets": ["alpha_key"]
  },
  "capabilities": {
    "pagination": true,
    "details": true
  }
}
